[
  {
    "skill_id": "skill-leadership",
    "skill_name": "Leadership & Influence",
    "category": "leadership_management",
    "sub_category": "Team Leadership",
    "description": "Ability to guide teams, influence stakeholders, and drive cross-functional outcomes.",
    "proficiency_level": "expert",
    "usage_notes": "Demonstrated across IT operations, customer success, and military service.",
    "evidence_links": ["bul-0102", "bul-0103", "ach-0102"],
    "keyword_variants": ["leadership", "team leadership", "influence"],
    "relevance_weight": 0.95,
    "last_used_date": "2026-05-31"
  },
  {
    "skill_id": "skill-governance",
    "skill_name": "Governance & Operational Oversight",
    "category": "leadership_management",
    "sub_category": "Governance",
    "description": "Ensuring consistency, compliance, and operational discipline across teams and systems.",
    "proficiency_level": "advanced",
    "usage_notes": "Applied in Navy readiness reporting and IT incident governance.",
    "evidence_links": ["bul-0001", "bul-0103", "ach-0001"],
    "keyword_variants": ["governance", "oversight", "operational governance"],
    "relevance_weight": 0.90,
    "last_used_date": "2026-05-31"
  },
  {
    "skill_id": "skill-sre",
    "skill_name": "Site Reliability Engineering (SRE)",
    "category": "technical_engineering",
    "sub_category": "Infrastructure",
    "description": "Applying SRE principles to improve reliability, reduce incidents, and automate operations.",
    "proficiency_level": "advanced",
    "usage_notes": "Implemented automated health checks and incident reduction strategies.",
    "evidence_links": ["bul-0101", "ach-0101"],
    "keyword_variants": ["SRE", "reliability engineering"],
    "relevance_weight": 0.92,
    "last_used_date": "2026-05-31"
  },
  {
    "skill_id": "skill-automation",
    "skill_name": "Automation & Workflow Optimization",
    "category": "technical_engineering",
    "sub_category": "Automation",
    "description": "Designing and implementing automated workflows to improve efficiency and reduce manual effort.",
    "proficiency_level": "advanced",
    "usage_notes": "Used in IT operations to automate health checks and reduce incidents.",
    "evidence_links": ["bul-0101", "ach-0101"],
    "keyword_variants": ["automation", "workflow automation"],
    "relevance_weight": 0.90,
    "last_used_date": "2026-05-31"
  },
  {
    "skill_id": "skill-dbase",
    "skill_name": "dBase Systems",
    "category": "technical_engineering",
    "sub_category": "Applications",
    "description": "Experience building and maintaining dBase-driven administrative systems.",
    "proficiency_level": "intermediate",
    "usage_notes": "Used in Navy administrative and readiness reporting systems.",
    "evidence_links": ["bul-0001", "ach-0001"],
    "keyword_variants": ["dBase", "database systems"],
    "relevance_weight": 0.75,
    "last_used_date": "1994-06-01"
  },
  {
    "skill_id": "skill-itil",
    "skill_name": "ITIL Practices",
    "category": "process_governance_operations",
    "sub_category": "ITIL",
    "description": "Incident, change, and problem management aligned with ITIL frameworks.",
    "proficiency_level": "advanced",
    "usage_notes": "Applied in IT operations leadership roles.",
    "evidence_links": ["bul-0103", "ach-0101"],
    "keyword_variants": ["ITIL", "incident management", "change management"],
    "relevance_weight": 0.88,
    "last_used_date": "2026-05-31"
  },
  {
    "skill_id": "skill-operations",
    "skill_name": "Operational Excellence",
    "category": "process_governance_operations",
    "sub_category": "Operational Excellence",
    "description": "Driving reliability, consistency, and efficiency across systems and teams.",
    "proficiency_level": "expert",
    "usage_notes": "Demonstrated in both Navy and IT operations roles.",
    "evidence_links": ["bul-0003", "bul-0101", "ach-0101"],
    "keyword_variants": ["operations", "operational excellence"],
    "relevance_weight": 0.93,
    "last_used_date": "2026-05-31"
  },
  {
    "skill_id": "skill-communication",
    "skill_name": "Communication & Stakeholder Engagement",
    "category": "communication_collaboration",
    "sub_category": "Cross-Functional Collaboration",
    "description": "Clear communication across technical and business teams to drive alignment.",
    "proficiency_level": "expert",
    "usage_notes": "Used extensively in OCM, customer success, and leadership roles.",
    "evidence_links": ["bul-0201", "bul-0102", "ach-0201"],
    "keyword_variants": ["communication", "stakeholder engagement"],
    "relevance_weight": 0.94,
    "last_used_date": "2026-05-31"
  },
  {
    "skill_id": "skill-training",
    "skill_name": "Training & Enablement",
    "category": "communication_collaboration",
    "sub_category": "Training & Documentation",
    "description": "Developing and delivering training programs that improve adoption and proficiency.",
    "proficiency_level": "expert",
    "usage_notes": "Demonstrated in Navy onboarding and ERP transformation projects.",
    "evidence_links": ["bul-0002", "bul-0202", "ach-0202"],
    "keyword_variants": ["training", "enablement", "instruction"],
    "relevance_weight": 0.90,
    "last_used_date": "2026-05-31"
  },
  {
    "skill_id": "skill-ocm",
    "skill_name": "Organizational Change Management (OCM)",
    "category": "domain_industry",
    "sub_category": "Change Management",
    "description": "Supporting enterprise transformations through communication, training, and readiness planning.",
    "proficiency_level": "advanced",
    "usage_notes": "Applied during ERP rollout and enterprise change initiatives.",
    "evidence_links": ["bul-0201", "ach-0201"],
    "keyword_variants": ["OCM", "change management"],
    "relevance_weight": 0.89,
    "last_used_date": "2017-12-01"
  },
  {
    "skill_id": "skill-customer-success",
    "skill_name": "Customer Success Management",
    "category": "domain_industry",
    "sub_category": "Customer Support",
    "description": "Driving customer outcomes, retention, and long-term relationships.",
    "proficiency_level": "expert",
    "usage_notes": "Used in enterprise onboarding and customer engagement roles.",
    "evidence_links": ["bul-0102", "bul-0104", "ach-0102"],
    "keyword_variants": ["customer success", "CSM"],
    "relevance_weight": 0.92,
    "last_used_date": "2026-05-31"
  }
]
